{
  "$schema": "https://json-schema.org/draft/2020-12/schema",
  "$id": "https://github.com/andrecpramos/sdlc-kit/sdlc.config.schema.json",
  "title": "SDLC kit configuration",
  "description": "The single machine-readable description of a repository's SDLC. Hooks, slash commands and agents read this file instead of hardcoding branch names and gate commands, which is what makes the kit portable. Lives at .ai/sdlc.config.json.",
  "type": "object",
  "required": ["version", "branching", "gates"],
  "additionalProperties": false,

  "properties": {
    "$schema": { "type": "string" },

    "version": {
      "const": 1,
      "description": "Config format version. Bump only on a breaking change to this schema."
    },

    "project": {
      "type": "object",
      "additionalProperties": false,
      "properties": {
        "name": { "type": "string" },
        "kind": {
          "type": "string",
          "description": "Free text: 'monorepo', 'library', 'service', 'mobile app', 'CLI'. Used only in generated prose."
        },
        "stack": {
          "type": "array",
          "items": { "type": "string" },
          "description": "e.g. [\"TypeScript\", \"Node 23\", \"pnpm\", \"Next.js\"]. The bootstrap detects these; correct them by hand if it guesses wrong."
        },
        "packageManager": {
          "type": "string",
          "enum": ["pnpm", "npm", "yarn", "bun", "cargo", "go", "uv", "poetry", "pip", "gradle", "maven", "dotnet", "other"]
        },
        "runtime": {
          "type": "string",
          "description": "Minimum runtime that actually works, not what the manifest claims. e.g. \"node>=23.6\"."
        }
      }
    },

    "branching": {
      "type": "object",
      "required": ["model", "production"],
      "additionalProperties": false,
      "description": "Which branch is production, where work lands, and whether an agent may move production on its own.",
      "properties": {
        "model": {
          "enum": ["two-trunk", "trunk", "gitflow"],
          "description": "two-trunk: production + integration (main/develop). trunk: one branch, short-lived feature branches. gitflow: adds release/* and hotfix/* lines."
        },
        "production": {
          "type": "string",
          "description": "The branch that is deployed. Never written by an agent unless releaseOnRequestOnly is false."
        },
        "integration": {
          "type": "string",
          "description": "Where day-to-day work lands and where feature branches are cut from. Omit for the trunk model; production is then also the integration branch."
        },
        "featurePrefix": {
          "type": "string",
          "default": "feature/",
          "description": "Proposed prefix when the session hook suggests a branch name."
        },
        "releaseOnRequestOnly": {
          "type": "boolean",
          "default": true,
          "description": "true = an agent never pushes, merges or opens a PR to production on its own initiative. This is the rule guard-git.mjs enforces locally."
        },
        "protectedRefs": {
          "type": "array",
          "items": { "type": "string" },
          "description": "Extra refs that are treated as production for guard purposes, e.g. [\"release/*\", \"staging\"]."
        }
      }
    },

    "sharedTree": {
      "type": "boolean",
      "default": false,
      "description": "true when more than one agent session works in this checkout at once. Enables the broad-staging denial (git add -A / git add . / git commit -a) and the 're-check status before committing' instruction."
    },

    "commits": {
      "type": "object",
      "additionalProperties": false,
      "properties": {
        "convention": {
          "enum": ["conventional", "none"],
          "default": "conventional"
        },
        "scopes": {
          "type": "array",
          "items": { "type": "string" },
          "description": "Allowed commit scopes. Empty means unconstrained."
        },
        "trailers": {
          "type": "array",
          "items": { "type": "string" },
          "description": "Lines appended to every commit message, e.g. a Co-Authored-By trailer."
        }
      }
    },

    "gates": {
      "type": "array",
      "description": "Every check that must pass before work merges, cheapest first. /gates runs this list in order; the gate-runner agent runs it in its own context. The order in this array is the order they run.",
      "items": {
        "type": "object",
        "required": ["id", "command"],
        "additionalProperties": false,
        "properties": {
          "id": {
            "type": "string",
            "pattern": "^[a-z0-9][a-z0-9-]*$",
            "description": "Stable slug. Referenced by critical-infrastructure.md and by CI job names."
          },
          "title": { "type": "string", "description": "One line, human-facing." },
          "command": { "type": "string", "description": "Exactly what CI runs. If it differs from CI, this file is lying." },
          "blocking": {
            "type": "boolean",
            "default": true,
            "description": "false = reported but does not block a merge. Be honest here; an advisory gate marked blocking is how a green build starts meaning nothing."
          },
          "rule": {
            "type": "string",
            "description": "The rule id from .ai/rules.md that this gate holds up. Omit if the gate enforces no stated rule."
          },
          "expectNonZero": {
            "type": "boolean",
            "default": false,
            "description": "true for a command that exits non-zero by design and whose real verdict comes from a comparison step. Prevents a runner reporting a designed exit code as a failure."
          },
          "when": {
            "type": "array",
            "items": { "type": "string" },
            "description": "Glob patterns. The gate runs only if the working diff touches a matching path. Omit to always run."
          },
          "fix": {
            "type": "string",
            "description": "The first thing to try when this gate fails. Shown verbatim in the /gates failure report."
          }
        }
      }
    },

    "docs": {
      "type": "object",
      "additionalProperties": false,
      "properties": {
        "root": { "type": "string", "default": ".ai", "description": "Where the knowledge base lives." },
        "rules": { "type": "string", "description": "Path to the numbered invariant register. Default .ai/rules.md; point it at PLAN.md#2 or similar if the rules already live elsewhere." },
        "decisions": { "type": "string", "default": ".ai/decisions", "description": "ADR directory." },
        "plan": { "type": "string", "description": "The living work-schedule document, if the repo has one. Read by /handoff." }
      }
    },

    "guard": {
      "type": "object",
      "additionalProperties": false,
      "description": "What the PreToolUse Bash guard denies. Every denial names its correct alternative, so an agent retries without needing the user.",
      "properties": {
        "denyBroadStaging": { "type": "boolean", "default": false, "description": "Defaults to the value of sharedTree." },
        "denyProductionWrites": { "type": "boolean", "default": true },
        "denyBranchFromProduction": { "type": "boolean", "default": true },
        "extraDeny": {
          "type": "array",
          "description": "Repo-specific denials.",
          "items": {
            "type": "object",
            "required": ["pattern", "reason"],
            "additionalProperties": false,
            "properties": {
              "pattern": { "type": "string", "description": "JavaScript regular expression source, matched against the Bash command with heredoc bodies stripped." },
              "reason": { "type": "string" },
              "instead": { "type": "string", "description": "The command the agent should run instead." }
            }
          }
        }
      }
    },

    "postEdit": {
      "type": "array",
      "description": "Fast checks surfaced immediately after an Edit/Write to a matching path. Keep this list short and the commands under a second — a hook that comments on every write becomes noise an agent learns to skim, which is worse than no hook.",
      "items": {
        "type": "object",
        "required": ["paths"],
        "additionalProperties": false,
        "properties": {
          "paths": { "type": "array", "items": { "type": "string" }, "description": "Glob patterns matched against the edited file." },
          "run": { "type": "string", "description": "Command to execute. Its output is shown only on failure." },
          "remind": { "type": "string", "description": "Static text shown when a path matches. Use when there is no cheap command." },
          "timeoutMs": { "type": "integer", "default": 5000 }
        }
      }
    }
  }
}
